{
  "$schema": "https://json-schema.org/draft/2020-12/schema",
  "title": "Project",
  "description": "A project in my portfolio",
  "type": "object",
  "properties": {
    "name": {
      "description": "name of the project",
      "type": "string"
    },
    "description": {
      "description": "description of the project",
      "type": "string"
    },
    "status": {
      "description": "the status of the project's development",
      "type": "string",
      "enum": [
        "In-progress",
        "Active",
        "Complete",
        "Incomplete"
      ]
    },
    "languages": {
      "description": "Programming languages used by the project",
      "type": "array",
      "items": {
        "type": "string"
      }
    },
    "frameworks": {
      "description": "Programming frameworks used by the project",
      "type": "array",
      "items": {
        "type": "string"
      }
    },
    "skills": {
      "description": "Skills demonstrated by the project",
      "type": "array",
      "items": {
        "type": "string"
      }
    },
    "repo": {
      "description": "The repository where the project source code can be found",
      "type": "string"
    },
    "site": {
      "description": "The URL of the website where the project is hosted",
      "type": "string"
    },
    "package": {
      "description": "The package from which the project can be installed",
      "type": "object",
      "properties": {
        "command": {
          "description": "The command to use when installing the package",
          "url": "The URL to find the project on the package management website"
        }
      }
    }
  },
  "required": [
    "name",
    "description",
    "status",
    "languages",
    "frameworks",
    "skills"
  ]
}
