{
  "$schema": "../project.schema.json",
  "name": "FL Studio API Stubs",
  "description": "Type definitions, and full documentation for FL Studio's MIDI Controller Scripting API",
  "status": "Active",
  "repo": "https://github.com/MiguelGuthridge/FL-Studio-API-Stubs",
  "site": "https://miguelguthridge.github.io/FL-Studio-API-Stubs/",
  "languages": ["python"],
  "frameworks": [
    "fl-studio-midi-controller-scripting",
    "mkdocs"
  ],
  "skills": [],
  "package": {
    "url": "https://pypi.org/project/fl-studio-api-stubs/",
    "command": "pip install fl-studio-api-stubs"
  }
}
