{
  "name": "Equator",
  "description": "A symbolic math interpreter built using Sympy",
  "status": "Complete",
  "repo": "https://github.com/MiguelGuthridge/Equator",
  "languages": ["python"],
  "frameworks": [
    "sympy",
    "ncurses"
  ],
  "skills": [
    "static-analysis"
  ],
  "package": {
    "url": "https://pypi.org/project/equatorpy/",
    "command": "pip install equatorpy"
  }
}
