{
  "$schema": "../project.schema.json",
  "name": "Portfolio",
  "description": "My portfolio website -- you're looking at it",
  "status": "Active",
  "repo": "https://github.com/MiguelGuthridge/miguelguthridge.com",
  "site": "https://miguelguthridge.com",
  "languages": ["typescript"],
  "frameworks": ["next"],
  "skills": []
}
